{
  "$schema": "https://json-schema.org/draft/2020-12/schema",
  "$id": "https://schemas.blackceo.dev/candice/status-event.schema.json",
  "title": "Candice Status Event",
  "description": "Real project/session state published to the Candice Companion, one event per source state. Progress is never invented: only state that actually exists in the Claude session or the invoked skill is reported. Candice Master Spec section 16. Version: 1.0.",
  "type": "object",
  "additionalProperties": false,
  "required": [
    "schemaVersion",
    "sessionId",
    "event",
    "phase",
    "message",
    "captions",
    "timestamp"
  ],
  "properties": {
    "schemaVersion": {
      "type": "string",
      "const": "1.0",
      "description": "Version of this event schema. Bumped by the integration/release owner only (manifest 9.4 class 2)."
    },
    "sessionId": {
      "type": "string",
      "minLength": 1,
      "description": "Opaque session id the status belongs to. Status events from an unknown session are ignored; host-window placement is never session identity."
    },
    "event": {
      "type": "string",
      "enum": ["status"],
      "description": "Event discriminator for the shared envelope."
    },
    "phase": {
      "type": "string",
      "enum": [
        "CHECKING_SETUP",
        "INTERVIEW",
        "BUILDING",
        "QUALITY_CHECKING",
        "FIXING",
        "WAITING_FOR_USER",
        "COMPLETE",
        "RECOVERING",
        "TEXT_FALLBACK",
        "IDLE",
        "CLOSED"
      ],
      "description": "The companion's display state, driven only by real skill/session state. TEXT_FALLBACK means the companion is unavailable and the session is in Claude text mode; failure never stops Claude."
    },
    "message": {
      "type": "string",
      "minLength": 1,
      "description": "Human-readable status line, also shown as a caption."
    },
    "captions": {
      "type": "boolean",
      "description": "Captions are always shown regardless of voice-output state; the field records whether this event carries a caption for accessibility."
    },
    "timestamp": {
      "type": "string",
      "format": "date-time",
      "description": "UTC timestamp supplied by the caller. Never generated inside the companion runtime."
    },
    "detail": {
      "type": "object",
      "additionalProperties": true,
      "description": "Optional extension fields (e.g. progress counts) with no schema obligation beyond being JSON. Never used to invent progress."
    }
  }
}
